{
  "schema_version": 2,
  "token_set_id": "deslop-ui-hard-001",
  "colors": {
    "canvas": "oklch(97% 0.01 80)",
    "surface": "#ffffff",
    "text": "oklch(22% 0.02 260)",
    "text_muted": "rgb(88 94 107)",
    "accent": "#2457d6",
    "border": "hsl(220 15% 82%)"
  },
  "type": {
    "font_family": "Inter, system-ui, sans-serif",
    "body_size": "1rem",
    "body_line_height": "1.5",
    "heading_size": "2.5rem",
    "heading_line_height": "1.1",
    "weight_regular": 400,
    "weight_medium": 500,
    "weight_bold": 700
  },
  "spacing": {
    "xs": "0.25rem",
    "sm": "0.5rem",
    "md": "1rem",
    "lg": "1.5rem",
    "xl": "2.5rem"
  },
  "radii": {
    "sm": "0.25rem",
    "md": "0.75rem",
    "pill": "999px"
  }
}
